{"$id":"https://outerheavenx.github.io/citadel-of-vesper/schemas/armor.schema.json","$schema":"https://json-schema.org/draft/2020-12/schema","additionalProperties":false,"description":"Armor definition (head/body/offhand slots).","properties":{"category":{"const":"armor"},"description":{"type":"string"},"flavor":{"type":"string"},"icon":{"type":"string"},"id":{"pattern":"^[a-z0-9_]+$","type":"string"},"name":{"type":"string"},"rarity":{"enum":["common","uncommon","rare","epic","legendary"]},"resistances":{"additionalProperties":{"minimum":0,"type":"number"},"description":"Elemental mitigation 0..1, e.g. { fire: 0.15 }.","type":"object"},"slot":{"enum":["head","body","offhand"]},"stats":{"additionalProperties":{"type":"number"},"type":"object"},"value":{"minimum":0,"type":"integer"}},"required":["id","name","category","slot","description","rarity","value","icon","stats"],"title":"Armor","type":"object"}