[{"category":"armor","description":"A heavy traveler's coat, patched many times. Turns aside glancing blows.","icon":"wayfarer_coat","id":"wayfarer_coat","name":"Wayfarer's Coat","rarity":"common","slot":"body","stats":{"def":6,"hp":10},"value":40},{"category":"armor","description":"A deep hood dyed the color of the hour before night. Muffles sound, sharpens sight.","flavor":"Lucien pulls it lower when the wind carries voices.","icon":"dusk_hood","id":"dusk_hood","name":"Dusk Hood","rarity":"uncommon","resistances":{"shadow":0.1},"slot":"head","stats":{"def":4,"dex":2},"value":120}]